{
  "agent": {
    "agent_commit": "redacted-or-local",
    "agent_type": "llm_policy",
    "model_display_name": "gemini-3.1-pro",
    "model_family": "gemini-3.1-pro",
    "model_identifier_redacted": false,
    "parse_coverage": 1.0,
    "prompt_mode": "rationale",
    "prompt_version": "risk-feedback-v1",
    "provider": "poe",
    "response_format": "json_object",
    "risk_feedback_mode": "true"
  },
  "data_source": {
    "data_hash": "sha256:high_vol-synthetic-seed-17-symbols-SYN-ALT-periods-8",
    "frequency": "daily",
    "name": "synthetic-market",
    "symbols": [
      "SYN",
      "ALT"
    ],
    "timestamp_policy": "relative_masked"
  },
  "execution_config": {
    "base_slippage_bps": 2.0,
    "commission_bps": 1.0,
    "latency_steps": 1,
    "market_impact": 0.15,
    "participation_rate": 0.05,
    "spread_bps": 0.0
  },
  "metrics": {
    "execution_fill_rate": 0.75,
    "max_drawdown": -0.004041424009702865,
    "rejected_order_count": 2,
    "risk_clipped_decisions": 6,
    "risk_violation_count": 0,
    "sharpe": 6.936511012321784,
    "total_return": 0.014380820994550625,
    "trajectory_reproducibility_coverage": 1.0
  },
  "redaction": {
    "notes": "Leaderboard smoke manifest generated from a live or cache-backed provider run; raw prompts and responses remain in ignored local cache files.",
    "provider_secrets_removed": true,
    "raw_provider_text_removed": true,
    "timestamps_masked": true
  },
  "reproducibility_hash": "sha256:f17bd495aee155bd7ce6f0f18c41dff46ab0b1c6226edeb9fd5d3aa310ff8852",
  "risk_config": {
    "risk_budget": {
      "max_gross_exposure": 1.0,
      "max_position_weight": 0.35,
      "max_single_step_turnover": 0.75,
      "risk_feedback_mode": "true"
    },
    "risk_manager": "max-position"
  },
  "scenario_id": "leaderboard_llm_high_vol_synthetic_v0_1",
  "schema_version": "0.1",
  "trajectory_manifest": {
    "artifact_hashes": {
      "redacted_summary": "sha256:d9bd12bad0d5c608b79a932a98f86d449c80013fce579213a1a415bf1a6c9144"
    },
    "format": "redacted_manifest",
    "manifest_hash": "sha256:d9bd12bad0d5c608b79a932a98f86d449c80013fce579213a1a415bf1a6c9144",
    "path_or_uri": "docs/results/model_matrix/high_vol__poe_gemini_3_1_pro_summary.json",
    "raw_prompts_included": false,
    "raw_responses_included": false
  }
}
