{
  "agent": {
    "agent_commit": "redacted-or-local",
    "agent_type": "llm_policy",
    "model_display_name": "deepseek-v4-pro",
    "model_family": "deepseek-v4-pro",
    "model_identifier_redacted": false,
    "parse_coverage": 1.0,
    "prompt_mode": "rationale",
    "prompt_version": "risk-feedback-v1",
    "provider": "deepseek",
    "response_format": "json_object",
    "risk_feedback_mode": "true"
  },
  "data_source": {
    "data_hash": "sha256:synthetic-seed-7-symbols-SYN-ALT-periods-8",
    "frequency": "daily",
    "name": "synthetic-market",
    "symbols": [
      "SYN",
      "ALT"
    ],
    "timestamp_policy": "relative_masked"
  },
  "execution_config": {
    "base_slippage_bps": 2.0,
    "commission_bps": 1.0,
    "latency_steps": 1,
    "market_impact": 0.15,
    "participation_rate": 0.05,
    "spread_bps": 0.0
  },
  "metrics": {
    "execution_fill_rate": 0.6666666666666666,
    "max_drawdown": -0.0005222525977854886,
    "rejected_order_count": 1,
    "risk_clipped_decisions": 4,
    "risk_violation_count": 9,
    "sharpe": 7.285735559476281,
    "total_return": 0.02395016123958449,
    "trajectory_reproducibility_coverage": 1.0
  },
  "redaction": {
    "notes": "Leaderboard smoke manifest generated from a live or cache-backed provider run; raw prompts and responses remain in ignored local cache files.",
    "provider_secrets_removed": true,
    "raw_provider_text_removed": true,
    "timestamps_masked": true
  },
  "reproducibility_hash": "sha256:292f01e9176b29e0c5d2008a5e18d329ad4cec860b0a3c9899c195155e406d75",
  "risk_config": {
    "risk_budget": {
      "max_gross_exposure": 1.0,
      "max_position_weight": 0.35,
      "max_single_step_turnover": 0.75,
      "risk_feedback_mode": "true"
    },
    "risk_manager": "max-position"
  },
  "scenario_id": "leaderboard_llm_smoke_synthetic_v0_1",
  "schema_version": "0.1",
  "trajectory_manifest": {
    "artifact_hashes": {
      "redacted_summary": "sha256:5d2f5b1a65bfd21a927205d025cc5dc3f1a0a7cc5aa313756305a959e6e0b2d4"
    },
    "format": "redacted_manifest",
    "manifest_hash": "sha256:5d2f5b1a65bfd21a927205d025cc5dc3f1a0a7cc5aa313756305a959e6e0b2d4",
    "path_or_uri": "docs/results/model_matrix/deepseek_deepseek_v4_pro_summary.json",
    "raw_prompts_included": false,
    "raw_responses_included": false
  }
}
