{
  "agent": {
    "agent_commit": "redacted-or-local",
    "agent_type": "llm_policy",
    "model_display_name": "glm-5",
    "model_family": "glm-5",
    "model_identifier_redacted": false,
    "parse_coverage": 0.9167,
    "prompt_mode": "rationale",
    "prompt_version": "risk-feedback-v1",
    "provider": "poe",
    "response_format": "json_object",
    "risk_feedback_mode": "true"
  },
  "data_source": {
    "data_hash": "sha256:a5cc889c07bd7a70b9413b00e624e2713f3c22dd61c99fa0e320b64229637948",
    "frequency": "weekly",
    "name": "yahoo-finance-csv",
    "symbols": [
      "GSPC",
      "BTC-USD",
      "BTC=F"
    ],
    "timestamp_policy": "relative_masked"
  },
  "execution_config": {
    "base_slippage_bps": 2.0,
    "commission_bps": 1.0,
    "latency_steps": 1,
    "market_impact": 0.15,
    "participation_rate": 0.05,
    "spread_bps": 0.0
  },
  "metrics": {
    "alpha_pre_risk_hit_rate": 0.6,
    "alpha_pre_risk_sharpe": -0.6887650900200153,
    "alpha_pre_risk_steps": 5,
    "alpha_pre_risk_total_return": -0.01382497561446816,
    "alpha_quality_score": 0.39038250794961243,
    "execution_fill_rate": 0.6666666666666666,
    "execution_robustness_score": 0.6533082230239653,
    "max_drawdown": -0.054961035306124284,
    "rejected_order_count": 5,
    "risk_clipped_decisions": 27,
    "risk_discipline_score": 0.23611111111111116,
    "risk_violation_count": 8,
    "sharpe": 1.34172916465153,
    "total_return": 0.02018179197191783,
    "trajectory_reproducibility_coverage": 1.0
  },
  "redaction": {
    "notes": "Real-market leaderboard manifest generated from Yahoo Finance CSV data. Raw prompts and responses remain in ignored local cache files.",
    "provider_secrets_removed": true,
    "raw_provider_text_removed": true,
    "timestamps_masked": true
  },
  "reproducibility_hash": "sha256:0876e7751807f8bb022bdeba8ad3c4146e69658500633513908246bf19875c3a",
  "risk_config": {
    "risk_budget": {
      "drawdown_de_risk_weight": 0.0,
      "drawdown_lookback": 5,
      "max_drawdown": 0.2,
      "max_gross_exposure": 1.0,
      "max_position_weight": 0.35,
      "max_single_step_turnover": 0.75,
      "risk_feedback_mode": "true"
    },
    "risk_manager": "max-position"
  },
  "scenario_id": "leaderboard_real_yahoo_2022_gspc_btc_btcf_weekly_v0_1",
  "schema_version": "0.1",
  "trajectory_manifest": {
    "artifact_hashes": {
      "redacted_summary": "sha256:80aad7b20228d0c3a53e7d332f311aa18ed2575cf900847e3e18931c0455b743"
    },
    "format": "redacted_manifest",
    "manifest_hash": "sha256:80aad7b20228d0c3a53e7d332f311aa18ed2575cf900847e3e18931c0455b743",
    "path_or_uri": "docs/results/real_market_matrix/rates_drawdown__poe_glm_5__seed_23_summary.json",
    "raw_prompts_included": false,
    "raw_responses_included": false
  }
}
