{
  "agent": {
    "agent_commit": "redacted-or-local",
    "agent_type": "llm_policy",
    "model_display_name": "deepseek-v4-flash",
    "model_family": "deepseek-v4-flash",
    "model_identifier_redacted": false,
    "parse_coverage": 1.0,
    "prompt_mode": "rationale",
    "prompt_version": "risk-feedback-v1",
    "provider": "deepseek",
    "response_format": "json_object",
    "risk_feedback_mode": "true"
  },
  "data_source": {
    "data_hash": "sha256:a5cc889c07bd7a70b9413b00e624e2713f3c22dd61c99fa0e320b64229637948",
    "frequency": "weekly",
    "name": "yahoo-finance-csv",
    "symbols": [
      "GSPC",
      "BTC-USD",
      "BTC=F"
    ],
    "timestamp_policy": "relative_masked"
  },
  "execution_config": {
    "base_slippage_bps": 2.0,
    "commission_bps": 1.0,
    "latency_steps": 1,
    "market_impact": 0.15,
    "participation_rate": 0.05,
    "spread_bps": 0.0
  },
  "metrics": {
    "alpha_pre_risk_hit_rate": 0.75,
    "alpha_pre_risk_sharpe": 5.706142941150857,
    "alpha_pre_risk_steps": 8,
    "alpha_pre_risk_total_return": 0.1808716762622935,
    "alpha_quality_score": 0.9500000000000001,
    "execution_fill_rate": 0.8,
    "execution_robustness_score": 0.6796416688752713,
    "max_drawdown": -0.056618626037848285,
    "rejected_order_count": 3,
    "risk_clipped_decisions": 31,
    "risk_discipline_score": 0.375,
    "risk_violation_count": 7,
    "sharpe": -1.1547731570035802,
    "total_return": -0.011080269274944876,
    "trajectory_reproducibility_coverage": 1.0
  },
  "redaction": {
    "notes": "Real-market leaderboard manifest generated from Yahoo Finance CSV data. Raw prompts and responses remain in ignored local cache files.",
    "provider_secrets_removed": true,
    "raw_provider_text_removed": true,
    "timestamps_masked": true
  },
  "reproducibility_hash": "sha256:1e387f026febbacee227ba0039137468355fe5a1757a0165e9dbeb08f0c9b873",
  "risk_config": {
    "risk_budget": {
      "drawdown_de_risk_weight": 0.0,
      "drawdown_lookback": 5,
      "max_drawdown": 0.2,
      "max_gross_exposure": 1.0,
      "max_position_weight": 0.35,
      "max_single_step_turnover": 0.75,
      "risk_feedback_mode": "true"
    },
    "risk_manager": "max-position"
  },
  "scenario_id": "leaderboard_real_yahoo_recent_gspc_btc_btcf_weekly_v0_1",
  "schema_version": "0.1",
  "trajectory_manifest": {
    "artifact_hashes": {
      "redacted_summary": "sha256:e4b7b1f75086aa18c67f62885e9f86affd0e1a3d22e8f2ceabae6b05d86e9bc1"
    },
    "format": "redacted_manifest",
    "manifest_hash": "sha256:e4b7b1f75086aa18c67f62885e9f86affd0e1a3d22e8f2ceabae6b05d86e9bc1",
    "path_or_uri": "docs/results/real_market_matrix/recent_cross_asset__deepseek_deepseek_v4_flash__seed_17_summary.json",
    "raw_prompts_included": false,
    "raw_responses_included": false
  }
}
