{
  "agent": {
    "agent_commit": "redacted-or-local",
    "agent_type": "llm_policy",
    "model_display_name": "deepseek-v4-pro",
    "model_family": "deepseek-v4-pro",
    "model_identifier_redacted": false,
    "parse_coverage": 1.0,
    "prompt_mode": "rationale",
    "prompt_version": "risk-feedback-v1",
    "provider": "deepseek",
    "response_format": "json_object",
    "risk_feedback_mode": "true"
  },
  "data_source": {
    "data_hash": "sha256:high_vol-synthetic-seed-17-symbols-SYN-ALT-periods-8",
    "frequency": "daily",
    "name": "synthetic-market",
    "symbols": [
      "SYN",
      "ALT"
    ],
    "timestamp_policy": "relative_masked"
  },
  "execution_config": {
    "base_slippage_bps": 2.0,
    "commission_bps": 1.0,
    "latency_steps": 1,
    "market_impact": 0.15,
    "participation_rate": 0.05,
    "spread_bps": 0.0
  },
  "metrics": {
    "alpha_pre_risk_hit_rate": 0.5,
    "alpha_pre_risk_sharpe": 5.685769658565769,
    "alpha_pre_risk_steps": 6,
    "alpha_pre_risk_total_return": 0.03518883842485976,
    "alpha_quality_score": 0.7541748864559344,
    "execution_fill_rate": 0.75,
    "execution_robustness_score": 0.7761800357054959,
    "max_drawdown": -0.006497134021152151,
    "rejected_order_count": 1,
    "risk_clipped_decisions": 9,
    "risk_discipline_score": 0.71875,
    "risk_violation_count": 0,
    "sharpe": 1.8655841484462325,
    "total_return": 0.004339085092315731,
    "trajectory_reproducibility_coverage": 1.0
  },
  "redaction": {
    "notes": "Leaderboard smoke manifest generated from a live or cache-backed provider run; raw prompts and responses remain in ignored local cache files.",
    "provider_secrets_removed": true,
    "raw_provider_text_removed": true,
    "timestamps_masked": true
  },
  "reproducibility_hash": "sha256:05e101952ae24d095162eab0825c55527082b1f979982c7a75502c3935912e4b",
  "risk_config": {
    "risk_budget": {
      "drawdown_de_risk_weight": 0.0,
      "drawdown_lookback": 5,
      "max_drawdown": 0.2,
      "max_gross_exposure": 1.0,
      "max_position_weight": 0.35,
      "max_single_step_turnover": 0.75,
      "risk_feedback_mode": "true"
    },
    "risk_manager": "max-position"
  },
  "scenario_id": "leaderboard_llm_high_vol_synthetic_v0_1",
  "schema_version": "0.1",
  "trajectory_manifest": {
    "artifact_hashes": {
      "redacted_summary": "sha256:c7596150f79c05e24131660ec3f6d7db2bda9d27974ac938b91d44d85d67c3cd"
    },
    "format": "redacted_manifest",
    "manifest_hash": "sha256:c7596150f79c05e24131660ec3f6d7db2bda9d27974ac938b91d44d85d67c3cd",
    "path_or_uri": "docs/results/model_matrix/high_vol__deepseek_deepseek_v4_pro_summary.json",
    "raw_prompts_included": false,
    "raw_responses_included": false
  }
}
