{
  "agent": {
    "agent_commit": "redacted-or-local",
    "agent_type": "llm_policy",
    "model_display_name": "gpt-5.5",
    "model_family": "gpt-5.5",
    "model_identifier_redacted": false,
    "parse_coverage": 1.0,
    "prompt_mode": "rationale",
    "prompt_version": "risk-feedback-v1",
    "provider": "poe",
    "response_format": "json_object",
    "risk_feedback_mode": "true"
  },
  "data_source": {
    "data_hash": "sha256:jump_tail-synthetic-seed-29-symbols-SYN-ALT-periods-8",
    "frequency": "daily",
    "name": "synthetic-market",
    "symbols": [
      "SYN",
      "ALT"
    ],
    "timestamp_policy": "relative_masked"
  },
  "execution_config": {
    "base_slippage_bps": 2.0,
    "commission_bps": 1.0,
    "latency_steps": 1,
    "market_impact": 0.15,
    "participation_rate": 0.05,
    "spread_bps": 0.0
  },
  "metrics": {
    "alpha_pre_risk_hit_rate": 0.5714285714285714,
    "alpha_pre_risk_sharpe": -1.9213386092768494,
    "alpha_pre_risk_steps": 7,
    "alpha_pre_risk_total_return": -0.015530147868385469,
    "alpha_quality_score": 0.3089314627073641,
    "execution_fill_rate": 0.6666666666666666,
    "execution_robustness_score": 0.6910414858298438,
    "max_drawdown": -0.021397961890934902,
    "rejected_order_count": 3,
    "risk_clipped_decisions": 12,
    "risk_discipline_score": 0.375,
    "risk_violation_count": 4,
    "sharpe": 2.9762006561932854,
    "total_return": 0.016686905489183834,
    "trajectory_reproducibility_coverage": 1.0
  },
  "redaction": {
    "notes": "Leaderboard smoke manifest generated from a live or cache-backed provider run; raw prompts and responses remain in ignored local cache files.",
    "provider_secrets_removed": true,
    "raw_provider_text_removed": true,
    "timestamps_masked": true
  },
  "reproducibility_hash": "sha256:50e42e87acb5866092c8059f76d9af57993deb02219c93b68e81ac9abe3da12a",
  "risk_config": {
    "risk_budget": {
      "drawdown_de_risk_weight": 0.0,
      "drawdown_lookback": 5,
      "max_drawdown": 0.2,
      "max_gross_exposure": 1.0,
      "max_position_weight": 0.35,
      "max_single_step_turnover": 0.75,
      "risk_feedback_mode": "true"
    },
    "risk_manager": "max-position"
  },
  "scenario_id": "leaderboard_llm_jump_tail_synthetic_v0_1",
  "schema_version": "0.1",
  "trajectory_manifest": {
    "artifact_hashes": {
      "redacted_summary": "sha256:e81f3ad2d0ada5f6a15f2e03f875bf6f9bb9eb10652924a0ff6ac0d31fb9b586"
    },
    "format": "redacted_manifest",
    "manifest_hash": "sha256:e81f3ad2d0ada5f6a15f2e03f875bf6f9bb9eb10652924a0ff6ac0d31fb9b586",
    "path_or_uri": "docs/results/model_matrix/jump_tail__poe_gpt_5_5_summary.json",
    "raw_prompts_included": false,
    "raw_responses_included": false
  }
}
