{
  "agent": {
    "agent_commit": "redacted-or-local",
    "agent_type": "control_policy",
    "model_display_name": "random",
    "model_family": "random",
    "model_identifier_redacted": false,
    "parse_coverage": 1.0,
    "prompt_mode": "rationale",
    "prompt_version": "risk-feedback-v1",
    "provider": "baseline",
    "response_format": "json_object",
    "risk_feedback_mode": "true"
  },
  "data_source": {
    "data_hash": "sha256:a5cc889c07bd7a70b9413b00e624e2713f3c22dd61c99fa0e320b64229637948",
    "frequency": "weekly",
    "name": "yahoo-finance-csv",
    "symbols": [
      "GSPC",
      "BTC-USD",
      "BTC=F"
    ],
    "timestamp_policy": "relative_masked"
  },
  "execution_config": {
    "base_slippage_bps": 2.0,
    "commission_bps": 1.0,
    "latency_steps": 1,
    "market_impact": 0.15,
    "participation_rate": 0.05,
    "spread_bps": 0.0
  },
  "metrics": {
    "alpha_pre_risk_hit_rate": 0.625,
    "alpha_pre_risk_sharpe": -2.1036826695449173,
    "alpha_pre_risk_steps": 8,
    "alpha_pre_risk_total_return": -0.05112438699992905,
    "alpha_quality_score": 0.23497012925015964,
    "execution_fill_rate": 0.7352941176470589,
    "execution_robustness_score": 0.6555964193418105,
    "max_drawdown": -0.022573242770756896,
    "rejected_order_count": 6,
    "risk_clipped_decisions": 0,
    "risk_discipline_score": 0.02777777777777779,
    "risk_violation_count": 17,
    "sharpe": 4.4351273752449245,
    "total_return": 0.07211065554151874,
    "trajectory_reproducibility_coverage": 1.0
  },
  "redaction": {
    "notes": "Real-market leaderboard manifest generated from Yahoo Finance CSV data. Raw prompts and responses remain in ignored local cache files.",
    "provider_secrets_removed": true,
    "raw_provider_text_removed": true,
    "timestamps_masked": true
  },
  "reproducibility_hash": "sha256:7aa11e67f69ac91c26333c66126c35925ee3b1caf5c27830a528206aab38b2ab",
  "risk_config": {
    "risk_budget": {
      "drawdown_de_risk_weight": 0.0,
      "drawdown_lookback": 5,
      "max_drawdown": 0.2,
      "max_gross_exposure": 1.0,
      "max_position_weight": 0.35,
      "max_single_step_turnover": 0.75,
      "risk_feedback_mode": "true"
    },
    "risk_manager": "max-position"
  },
  "scenario_id": "leaderboard_real_yahoo_2022_gspc_btc_btcf_weekly_v0_1",
  "schema_version": "0.1",
  "trajectory_manifest": {
    "artifact_hashes": {
      "redacted_summary": "sha256:d486bd7c9ff96e18dcd604de1a11d7308209cf69581cad4c1345fe83a8c61c55"
    },
    "format": "redacted_manifest",
    "manifest_hash": "sha256:d486bd7c9ff96e18dcd604de1a11d7308209cf69581cad4c1345fe83a8c61c55",
    "path_or_uri": "docs/results/real_market_matrix/rates_drawdown__baseline_random__seed_11_summary.json",
    "raw_prompts_included": false,
    "raw_responses_included": false
  }
}
