{
  "agent": {
    "agent_commit": "redacted-or-local",
    "agent_type": "control_policy",
    "model_display_name": "random",
    "model_family": "random",
    "model_identifier_redacted": false,
    "parse_coverage": 1.0,
    "prompt_mode": "rationale",
    "prompt_version": "risk-feedback-v1",
    "provider": "baseline",
    "response_format": "json_object",
    "risk_feedback_mode": "true"
  },
  "data_source": {
    "data_hash": "sha256:spread_explosion-synthetic-seed-53-symbols-SYN-ALT-periods-8",
    "frequency": "daily",
    "name": "synthetic-market",
    "symbols": [
      "SYN",
      "ALT"
    ],
    "timestamp_policy": "relative_masked"
  },
  "execution_config": {
    "base_slippage_bps": 6.0,
    "commission_bps": 1.0,
    "latency_steps": 1,
    "market_impact": 0.25,
    "participation_rate": 0.05,
    "spread_bps": 150.0
  },
  "metrics": {
    "alpha_pre_risk_hit_rate": 0.8,
    "alpha_pre_risk_sharpe": 22.30895732061278,
    "alpha_pre_risk_steps": 5,
    "alpha_pre_risk_total_return": 0.054142366244284146,
    "alpha_quality_score": 0.8568203240496394,
    "execution_fill_rate": 0.75,
    "execution_robustness_score": 0.5269256191616599,
    "max_drawdown": -0.03919855744781997,
    "rejected_order_count": 2,
    "risk_clipped_decisions": 0,
    "risk_discipline_score": 0.125,
    "risk_violation_count": 6,
    "sharpe": 0.03720184332012039,
    "total_return": -0.0007107580610568043,
    "trajectory_reproducibility_coverage": 1.0
  },
  "redaction": {
    "notes": "Leaderboard smoke manifest generated from a live or cache-backed provider run; raw prompts and responses remain in ignored local cache files.",
    "provider_secrets_removed": true,
    "raw_provider_text_removed": true,
    "timestamps_masked": true
  },
  "reproducibility_hash": "sha256:41b6d20be85b2c237ec9b8140eb59df1e79479ffe5eaf947bc1160e3edb8bd10",
  "risk_config": {
    "risk_budget": {
      "drawdown_de_risk_weight": 0.0,
      "drawdown_lookback": 5,
      "max_drawdown": 0.2,
      "max_gross_exposure": 1.0,
      "max_position_weight": 0.35,
      "max_single_step_turnover": 0.75,
      "risk_feedback_mode": "true"
    },
    "risk_manager": "max-position"
  },
  "scenario_id": "leaderboard_llm_spread_explosion_synthetic_v0_1",
  "schema_version": "0.1",
  "trajectory_manifest": {
    "artifact_hashes": {
      "redacted_summary": "sha256:18af313112ca03a5ea8e5f9f8c370b4128a66cbcec8ef8d11f36f9ffe65e91a9"
    },
    "format": "redacted_manifest",
    "manifest_hash": "sha256:18af313112ca03a5ea8e5f9f8c370b4128a66cbcec8ef8d11f36f9ffe65e91a9",
    "path_or_uri": "docs/results/model_matrix/spread_explosion__baseline_random__seed_53_summary.json",
    "raw_prompts_included": false,
    "raw_responses_included": false
  }
}
