{
  "agent": {
    "agent_commit": "redacted-or-local",
    "agent_type": "llm_policy",
    "model_display_name": "deepseek-v4-flash",
    "model_family": "deepseek-v4-flash",
    "model_identifier_redacted": false,
    "parse_coverage": 1.0,
    "prompt_mode": "rationale",
    "prompt_version": "risk-feedback-v1",
    "provider": "deepseek",
    "response_format": "json_object",
    "risk_feedback_mode": "true"
  },
  "data_source": {
    "data_hash": "sha256:high_vol-synthetic-seed-17-symbols-SYN-ALT-periods-8",
    "frequency": "daily",
    "name": "synthetic-market",
    "symbols": [
      "SYN",
      "ALT"
    ],
    "timestamp_policy": "relative_masked"
  },
  "execution_config": {
    "base_slippage_bps": 2.0,
    "commission_bps": 1.0,
    "latency_steps": 1,
    "market_impact": 0.15,
    "participation_rate": 0.05,
    "spread_bps": 0.0
  },
  "metrics": {
    "execution_fill_rate": 0.7692307692307693,
    "max_drawdown": -0.00754810941491646,
    "rejected_order_count": 1,
    "risk_clipped_decisions": 10,
    "risk_violation_count": 0,
    "sharpe": 1.361008796609703,
    "total_return": 0.00327664662175553,
    "trajectory_reproducibility_coverage": 1.0
  },
  "redaction": {
    "notes": "Leaderboard smoke manifest generated from a live or cache-backed provider run; raw prompts and responses remain in ignored local cache files.",
    "provider_secrets_removed": true,
    "raw_provider_text_removed": true,
    "timestamps_masked": true
  },
  "reproducibility_hash": "sha256:27ca3c0eccaa18edef5469e06e5b9d3048a78be83163848ed72ed67874bffb44",
  "risk_config": {
    "risk_budget": {
      "max_gross_exposure": 1.0,
      "max_position_weight": 0.35,
      "max_single_step_turnover": 0.75,
      "risk_feedback_mode": "true"
    },
    "risk_manager": "max-position"
  },
  "scenario_id": "leaderboard_llm_high_vol_synthetic_v0_1",
  "schema_version": "0.1",
  "trajectory_manifest": {
    "artifact_hashes": {
      "redacted_summary": "sha256:a8b21e62b0e0627da930174e20868a187091dd35d8b30a66472ce54e27dfc7c3"
    },
    "format": "redacted_manifest",
    "manifest_hash": "sha256:a8b21e62b0e0627da930174e20868a187091dd35d8b30a66472ce54e27dfc7c3",
    "path_or_uri": "docs/results/model_matrix/high_vol__deepseek_deepseek_v4_flash_summary.json",
    "raw_prompts_included": false,
    "raw_responses_included": false
  }
}
