{
  "agent": {
    "agent_commit": "redacted-or-local",
    "agent_type": "llm_policy",
    "model_display_name": "glm-5",
    "model_family": "glm-5",
    "model_identifier_redacted": false,
    "parse_coverage": 0.875,
    "prompt_mode": "rationale",
    "prompt_version": "risk-feedback-v1",
    "provider": "poe",
    "response_format": "json_object",
    "risk_feedback_mode": "true"
  },
  "data_source": {
    "data_hash": "sha256:latency_spike-synthetic-seed-65-symbols-SYN-ALT-periods-8",
    "frequency": "daily",
    "name": "synthetic-market",
    "symbols": [
      "SYN",
      "ALT"
    ],
    "timestamp_policy": "relative_masked"
  },
  "execution_config": {
    "base_slippage_bps": 4.0,
    "commission_bps": 1.0,
    "latency_steps": 4,
    "market_impact": 0.3,
    "participation_rate": 0.03,
    "spread_bps": 25.0
  },
  "metrics": {
    "execution_fill_rate": 0.3,
    "max_drawdown": -0.01326271723652983,
    "rejected_order_count": 0,
    "risk_clipped_decisions": 9,
    "risk_violation_count": 2,
    "sharpe": 0.3667793375159909,
    "total_return": 0.0010006922786887085,
    "trajectory_reproducibility_coverage": 1.0
  },
  "redaction": {
    "notes": "Leaderboard smoke manifest generated from a live or cache-backed provider run; raw prompts and responses remain in ignored local cache files.",
    "provider_secrets_removed": true,
    "raw_provider_text_removed": true,
    "timestamps_masked": true
  },
  "reproducibility_hash": "sha256:37c24c637fa4d46faae9e75f12508887c6791427b3a36614e7144b728376d86e",
  "risk_config": {
    "risk_budget": {
      "max_gross_exposure": 1.0,
      "max_position_weight": 0.35,
      "max_single_step_turnover": 0.75,
      "risk_feedback_mode": "true"
    },
    "risk_manager": "max-position"
  },
  "scenario_id": "leaderboard_llm_latency_spike_synthetic_v0_1",
  "schema_version": "0.1",
  "trajectory_manifest": {
    "artifact_hashes": {
      "redacted_summary": "sha256:f38d53b406ddc8e42eaa0c7b5171b890c4dfad5fa9d8771caa6fc849707558a1"
    },
    "format": "redacted_manifest",
    "manifest_hash": "sha256:f38d53b406ddc8e42eaa0c7b5171b890c4dfad5fa9d8771caa6fc849707558a1",
    "path_or_uri": "docs/results/model_matrix/latency_spike__poe_glm_5_summary.json",
    "raw_prompts_included": false,
    "raw_responses_included": false
  }
}
