{
  "agent": {
    "agent_commit": "redacted-or-local",
    "agent_type": "llm_policy",
    "model_display_name": "gpt-5.5",
    "model_family": "gpt-5.5",
    "model_identifier_redacted": false,
    "parse_coverage": 1.0,
    "prompt_mode": "rationale",
    "prompt_version": "risk-feedback-v1",
    "provider": "poe",
    "response_format": "json_object",
    "risk_feedback_mode": "true"
  },
  "data_source": {
    "data_hash": "sha256:a5cc889c07bd7a70b9413b00e624e2713f3c22dd61c99fa0e320b64229637948",
    "frequency": "weekly",
    "name": "yahoo-finance-csv",
    "symbols": [
      "GSPC",
      "BTC-USD",
      "BTC=F"
    ],
    "timestamp_policy": "relative_masked"
  },
  "execution_config": {
    "base_slippage_bps": 2.0,
    "commission_bps": 1.0,
    "latency_steps": 1,
    "market_impact": 0.15,
    "participation_rate": 0.05,
    "spread_bps": 0.0
  },
  "metrics": {
    "alpha_pre_risk_hit_rate": 0.625,
    "alpha_pre_risk_sharpe": -2.9805049391930223,
    "alpha_pre_risk_steps": 8,
    "alpha_pre_risk_total_return": -0.18612744110953094,
    "alpha_quality_score": 0.125,
    "execution_fill_rate": 0.6875,
    "execution_robustness_score": 0.5912952456834657,
    "max_drawdown": -0.11999968810059158,
    "rejected_order_count": 7,
    "risk_clipped_decisions": 36,
    "risk_discipline_score": 0.13888888888888884,
    "risk_violation_count": 13,
    "sharpe": -8.121019109595014,
    "total_return": -0.10311258473795815,
    "trajectory_reproducibility_coverage": 1.0
  },
  "redaction": {
    "notes": "Real-market leaderboard manifest generated from Yahoo Finance CSV data. Raw prompts and responses remain in ignored local cache files.",
    "provider_secrets_removed": true,
    "raw_provider_text_removed": true,
    "timestamps_masked": true
  },
  "reproducibility_hash": "sha256:892eda5d0bbb298a4a4a2f870ebe58ed8fdd8be3cbc3154dc979f119a22e862b",
  "risk_config": {
    "risk_budget": {
      "drawdown_de_risk_weight": 0.0,
      "drawdown_lookback": 5,
      "max_drawdown": 0.2,
      "max_gross_exposure": 1.0,
      "max_position_weight": 0.35,
      "max_single_step_turnover": 0.75,
      "risk_feedback_mode": "true"
    },
    "risk_manager": "max-position"
  },
  "scenario_id": "leaderboard_real_yahoo_recent_gspc_btc_btcf_weekly_v0_1",
  "schema_version": "0.1",
  "trajectory_manifest": {
    "artifact_hashes": {
      "redacted_summary": "sha256:7d532061ea8fbec08fd54f99a1f52b99b3d9a81d84f7303bcc9068b98fca6ae7"
    },
    "format": "redacted_manifest",
    "manifest_hash": "sha256:7d532061ea8fbec08fd54f99a1f52b99b3d9a81d84f7303bcc9068b98fca6ae7",
    "path_or_uri": "docs/results/real_market_matrix/recent_cross_asset__poe_gpt_5_5__seed_23_summary.json",
    "raw_prompts_included": false,
    "raw_responses_included": false
  }
}
