{
  "agent": {
    "agent_commit": "redacted-or-local",
    "agent_type": "llm_policy",
    "model_display_name": "deepseek-v4-pro",
    "model_family": "deepseek-v4-pro",
    "model_identifier_redacted": false,
    "parse_coverage": 1.0,
    "prompt_mode": "rationale",
    "prompt_version": "risk-feedback-v1",
    "provider": "deepseek",
    "response_format": "json_object",
    "risk_feedback_mode": "true"
  },
  "data_source": {
    "data_hash": "sha256:a5cc889c07bd7a70b9413b00e624e2713f3c22dd61c99fa0e320b64229637948",
    "frequency": "weekly",
    "name": "yahoo-finance-csv",
    "symbols": [
      "GSPC",
      "BTC-USD",
      "BTC=F"
    ],
    "timestamp_policy": "relative_masked"
  },
  "execution_config": {
    "base_slippage_bps": 2.0,
    "commission_bps": 1.0,
    "latency_steps": 1,
    "market_impact": 0.15,
    "participation_rate": 0.05,
    "spread_bps": 0.0
  },
  "metrics": {
    "alpha_pre_risk_hit_rate": 0.6666666666666666,
    "alpha_pre_risk_sharpe": -1.8518750322600006,
    "alpha_pre_risk_steps": 6,
    "alpha_pre_risk_total_return": -0.0456426069600161,
    "alpha_quality_score": 0.26427809079146375,
    "execution_fill_rate": 0.7619047619047619,
    "execution_robustness_score": 0.7146334409415962,
    "max_drawdown": -0.05293370324264335,
    "rejected_order_count": 5,
    "risk_clipped_decisions": 18,
    "risk_discipline_score": 0.38888888888888884,
    "risk_violation_count": 7,
    "sharpe": -0.9389030240950723,
    "total_return": -0.014423926637310625,
    "trajectory_reproducibility_coverage": 1.0
  },
  "redaction": {
    "notes": "Real-market leaderboard manifest generated from Yahoo Finance CSV data. Raw prompts and responses remain in ignored local cache files.",
    "provider_secrets_removed": true,
    "raw_provider_text_removed": true,
    "timestamps_masked": true
  },
  "reproducibility_hash": "sha256:a378c6db80c2cbd502b9f1113eeb6137d145074ba54f27a7092f413a645f03c2",
  "risk_config": {
    "risk_budget": {
      "drawdown_de_risk_weight": 0.0,
      "drawdown_lookback": 5,
      "max_drawdown": 0.2,
      "max_gross_exposure": 1.0,
      "max_position_weight": 0.35,
      "max_single_step_turnover": 0.75,
      "risk_feedback_mode": "true"
    },
    "risk_manager": "max-position"
  },
  "scenario_id": "leaderboard_real_yahoo_2022_gspc_btc_btcf_weekly_v0_1",
  "schema_version": "0.1",
  "trajectory_manifest": {
    "artifact_hashes": {
      "redacted_summary": "sha256:4bf33cbd74418de22fdef4f31cb6026c54185ddbc18b5e9b55ef11561aaf7b9c"
    },
    "format": "redacted_manifest",
    "manifest_hash": "sha256:4bf33cbd74418de22fdef4f31cb6026c54185ddbc18b5e9b55ef11561aaf7b9c",
    "path_or_uri": "docs/results/real_market_matrix/rates_drawdown__deepseek_deepseek_v4_pro__seed_31_summary.json",
    "raw_prompts_included": false,
    "raw_responses_included": false
  }
}
