{
  "agent": {
    "agent_commit": "redacted-or-local",
    "agent_type": "llm_policy",
    "model_display_name": "gemini-3.1-pro",
    "model_family": "gemini-3.1-pro",
    "model_identifier_redacted": false,
    "parse_coverage": 1.0,
    "prompt_mode": "rationale",
    "prompt_version": "risk-feedback-v1",
    "provider": "poe",
    "response_format": "json_object",
    "risk_feedback_mode": "true"
  },
  "data_source": {
    "data_hash": "sha256:jump_tail-synthetic-seed-29-symbols-SYN-ALT-periods-8",
    "frequency": "daily",
    "name": "synthetic-market",
    "symbols": [
      "SYN",
      "ALT"
    ],
    "timestamp_policy": "relative_masked"
  },
  "execution_config": {
    "base_slippage_bps": 2.0,
    "commission_bps": 1.0,
    "latency_steps": 1,
    "market_impact": 0.15,
    "participation_rate": 0.05,
    "spread_bps": 0.0
  },
  "metrics": {
    "execution_fill_rate": 0.6428571428571429,
    "max_drawdown": -0.007501423714052713,
    "rejected_order_count": 3,
    "risk_clipped_decisions": 9,
    "risk_violation_count": 3,
    "sharpe": 3.8126325800933936,
    "total_return": 0.015666191920414185,
    "trajectory_reproducibility_coverage": 1.0
  },
  "redaction": {
    "notes": "Leaderboard smoke manifest generated from a live or cache-backed provider run; raw prompts and responses remain in ignored local cache files.",
    "provider_secrets_removed": true,
    "raw_provider_text_removed": true,
    "timestamps_masked": true
  },
  "reproducibility_hash": "sha256:2b0ad1cdc2320edcdad5e129e469b423da875d500954c8657f37ddc60355ab2f",
  "risk_config": {
    "risk_budget": {
      "max_gross_exposure": 1.0,
      "max_position_weight": 0.35,
      "max_single_step_turnover": 0.75,
      "risk_feedback_mode": "true"
    },
    "risk_manager": "max-position"
  },
  "scenario_id": "leaderboard_llm_jump_tail_synthetic_v0_1",
  "schema_version": "0.1",
  "trajectory_manifest": {
    "artifact_hashes": {
      "redacted_summary": "sha256:b3a82fda9d68f039a3f5a72a89a16e9fc218e72e0475c4660af051c4d1c33a2f"
    },
    "format": "redacted_manifest",
    "manifest_hash": "sha256:b3a82fda9d68f039a3f5a72a89a16e9fc218e72e0475c4660af051c4d1c33a2f",
    "path_or_uri": "docs/results/model_matrix/jump_tail__poe_gemini_3_1_pro_summary.json",
    "raw_prompts_included": false,
    "raw_responses_included": false
  }
}
