{
  "agent": {
    "agent_commit": "redacted-or-local",
    "agent_type": "llm_policy",
    "model_display_name": "kimi-k2.5",
    "model_family": "kimi-k2.5",
    "model_identifier_redacted": false,
    "parse_coverage": 1.0,
    "prompt_mode": "rationale",
    "prompt_version": "risk-feedback-v1",
    "provider": "poe",
    "response_format": "json_object",
    "risk_feedback_mode": "true"
  },
  "data_source": {
    "data_hash": "sha256:calm_trend-synthetic-seed-7-symbols-SYN-ALT-periods-8",
    "frequency": "daily",
    "name": "synthetic-market",
    "symbols": [
      "SYN",
      "ALT"
    ],
    "timestamp_policy": "relative_masked"
  },
  "execution_config": {
    "base_slippage_bps": 2.0,
    "commission_bps": 1.0,
    "latency_steps": 1,
    "market_impact": 0.15,
    "participation_rate": 0.05,
    "spread_bps": 0.0
  },
  "metrics": {
    "execution_fill_rate": 0.75,
    "max_drawdown": -0.0008398349500295943,
    "rejected_order_count": 1,
    "risk_clipped_decisions": 11,
    "risk_violation_count": 1,
    "sharpe": 15.68365700095113,
    "total_return": 0.0319117870102712,
    "trajectory_reproducibility_coverage": 1.0
  },
  "redaction": {
    "notes": "Leaderboard smoke manifest generated from a live or cache-backed provider run; raw prompts and responses remain in ignored local cache files.",
    "provider_secrets_removed": true,
    "raw_provider_text_removed": true,
    "timestamps_masked": true
  },
  "reproducibility_hash": "sha256:657372beb82d54f41b17eae2246090e69958614fe77785e09a85f45528e79cee",
  "risk_config": {
    "risk_budget": {
      "max_gross_exposure": 1.0,
      "max_position_weight": 0.35,
      "max_single_step_turnover": 0.75,
      "risk_feedback_mode": "true"
    },
    "risk_manager": "max-position"
  },
  "scenario_id": "leaderboard_llm_calm_trend_synthetic_v0_1",
  "schema_version": "0.1",
  "trajectory_manifest": {
    "artifact_hashes": {
      "redacted_summary": "sha256:67b22095f9fa6bab10f76a990d4563f9e2c1c26e57553dae7b083eb5d53e114c"
    },
    "format": "redacted_manifest",
    "manifest_hash": "sha256:67b22095f9fa6bab10f76a990d4563f9e2c1c26e57553dae7b083eb5d53e114c",
    "path_or_uri": "docs/results/model_matrix/calm_trend__poe_kimi_k2_5_summary.json",
    "raw_prompts_included": false,
    "raw_responses_included": false
  }
}
