{
  "agent": {
    "agent_commit": "redacted-or-local",
    "agent_type": "llm_policy",
    "model_display_name": "deepseek-v4-flash",
    "model_family": "deepseek-v4-flash",
    "model_identifier_redacted": false,
    "parse_coverage": 1.0,
    "prompt_mode": "rationale",
    "prompt_version": "risk-feedback-v1",
    "provider": "deepseek",
    "response_format": "json_object",
    "risk_feedback_mode": "true"
  },
  "data_source": {
    "data_hash": "sha256:spread_explosion-synthetic-seed-53-symbols-SYN-ALT-periods-8",
    "frequency": "daily",
    "name": "synthetic-market",
    "symbols": [
      "SYN",
      "ALT"
    ],
    "timestamp_policy": "relative_masked"
  },
  "execution_config": {
    "base_slippage_bps": 6.0,
    "commission_bps": 1.0,
    "latency_steps": 1,
    "market_impact": 0.25,
    "participation_rate": 0.05,
    "spread_bps": 150.0
  },
  "metrics": {
    "execution_fill_rate": 0.7692307692307693,
    "max_drawdown": -0.042385397460331986,
    "rejected_order_count": 1,
    "risk_clipped_decisions": 9,
    "risk_violation_count": 1,
    "sharpe": -2.0151732350290548,
    "total_return": -0.015538595632362151,
    "trajectory_reproducibility_coverage": 1.0
  },
  "redaction": {
    "notes": "Leaderboard smoke manifest generated from a live or cache-backed provider run; raw prompts and responses remain in ignored local cache files.",
    "provider_secrets_removed": true,
    "raw_provider_text_removed": true,
    "timestamps_masked": true
  },
  "reproducibility_hash": "sha256:67f06bfaf6c18422eb9ed909199ac61ece52d1ab62e55fa181fe706b087fabe0",
  "risk_config": {
    "risk_budget": {
      "max_gross_exposure": 1.0,
      "max_position_weight": 0.35,
      "max_single_step_turnover": 0.75,
      "risk_feedback_mode": "true"
    },
    "risk_manager": "max-position"
  },
  "scenario_id": "leaderboard_llm_spread_explosion_synthetic_v0_1",
  "schema_version": "0.1",
  "trajectory_manifest": {
    "artifact_hashes": {
      "redacted_summary": "sha256:ef27f9dd9e12f6e417876ed5679cd12e506bc9c160129dc94f64ad51994916f8"
    },
    "format": "redacted_manifest",
    "manifest_hash": "sha256:ef27f9dd9e12f6e417876ed5679cd12e506bc9c160129dc94f64ad51994916f8",
    "path_or_uri": "docs/results/model_matrix/spread_explosion__deepseek_deepseek_v4_flash_summary.json",
    "raw_prompts_included": false,
    "raw_responses_included": false
  }
}
