{
  "agent": {
    "agent_commit": "redacted-or-local",
    "agent_type": "llm_policy",
    "model_display_name": "gemini-3.1-pro",
    "model_family": "gemini-3.1-pro",
    "model_identifier_redacted": false,
    "parse_coverage": 1.0,
    "prompt_mode": "rationale",
    "prompt_version": "risk-feedback-v1",
    "provider": "poe",
    "response_format": "json_object",
    "risk_feedback_mode": "true"
  },
  "data_source": {
    "data_hash": "sha256:synthetic-seed-7-symbols-SYN-ALT-periods-8",
    "frequency": "daily",
    "name": "synthetic-market",
    "symbols": [
      "SYN",
      "ALT"
    ],
    "timestamp_policy": "relative_masked"
  },
  "execution_config": {
    "base_slippage_bps": 2.0,
    "commission_bps": 1.0,
    "latency_steps": 1,
    "market_impact": 0.15,
    "participation_rate": 0.05,
    "spread_bps": 0.0
  },
  "metrics": {
    "execution_fill_rate": 0.6666666666666666,
    "max_drawdown": -0.0008398349500295943,
    "rejected_order_count": 2,
    "risk_clipped_decisions": 6,
    "risk_violation_count": 1,
    "sharpe": 16.029674089054723,
    "total_return": 0.025349810909030213,
    "trajectory_reproducibility_coverage": 1.0
  },
  "redaction": {
    "notes": "Leaderboard smoke manifest generated from a live or cache-backed provider run; raw prompts and responses remain in ignored local cache files.",
    "provider_secrets_removed": true,
    "raw_provider_text_removed": true,
    "timestamps_masked": true
  },
  "reproducibility_hash": "sha256:ba0fcb46ea635e1abc80488856e1d1a458e0343e863a86532e3504da498d46ad",
  "risk_config": {
    "risk_budget": {
      "max_gross_exposure": 1.0,
      "max_position_weight": 0.35,
      "max_single_step_turnover": 0.75,
      "risk_feedback_mode": "true"
    },
    "risk_manager": "max-position"
  },
  "scenario_id": "leaderboard_llm_smoke_synthetic_v0_1",
  "schema_version": "0.1",
  "trajectory_manifest": {
    "artifact_hashes": {
      "redacted_summary": "sha256:07a85714beb24cb5cf89c3fdfa4cc9e1880331e8e9b31863ce0cdd005f03f494"
    },
    "format": "redacted_manifest",
    "manifest_hash": "sha256:07a85714beb24cb5cf89c3fdfa4cc9e1880331e8e9b31863ce0cdd005f03f494",
    "path_or_uri": "docs/results/model_matrix/poe_gemini_3_1_pro_summary.json",
    "raw_prompts_included": false,
    "raw_responses_included": false
  }
}
