{
  "agent": {
    "agent_commit": "redacted-or-local",
    "agent_type": "llm_policy",
    "model_display_name": "kimi-k2.5",
    "model_family": "kimi-k2.5",
    "model_identifier_redacted": false,
    "parse_coverage": 1.0,
    "prompt_mode": "rationale",
    "prompt_version": "risk-feedback-v1",
    "provider": "poe",
    "response_format": "json_object",
    "risk_feedback_mode": "true"
  },
  "data_source": {
    "data_hash": "sha256:jump_tail-synthetic-seed-29-symbols-SYN-ALT-periods-8",
    "frequency": "daily",
    "name": "synthetic-market",
    "symbols": [
      "SYN",
      "ALT"
    ],
    "timestamp_policy": "relative_masked"
  },
  "execution_config": {
    "base_slippage_bps": 2.0,
    "commission_bps": 1.0,
    "latency_steps": 1,
    "market_impact": 0.15,
    "participation_rate": 0.05,
    "spread_bps": 0.0
  },
  "metrics": {
    "execution_fill_rate": 0.6666666666666666,
    "max_drawdown": -0.021397961890934902,
    "rejected_order_count": 3,
    "risk_clipped_decisions": 11,
    "risk_violation_count": 4,
    "sharpe": 2.9762006561932854,
    "total_return": 0.016686905489183834,
    "trajectory_reproducibility_coverage": 1.0
  },
  "redaction": {
    "notes": "Leaderboard smoke manifest generated from a live or cache-backed provider run; raw prompts and responses remain in ignored local cache files.",
    "provider_secrets_removed": true,
    "raw_provider_text_removed": true,
    "timestamps_masked": true
  },
  "reproducibility_hash": "sha256:f7385c431cb1184f1ff77eefaa9503abe3e981a392aed371c851669a804a6b80",
  "risk_config": {
    "risk_budget": {
      "max_gross_exposure": 1.0,
      "max_position_weight": 0.35,
      "max_single_step_turnover": 0.75,
      "risk_feedback_mode": "true"
    },
    "risk_manager": "max-position"
  },
  "scenario_id": "leaderboard_llm_jump_tail_synthetic_v0_1",
  "schema_version": "0.1",
  "trajectory_manifest": {
    "artifact_hashes": {
      "redacted_summary": "sha256:c810af6bab5b569b4a37c6ad572f9bb4cb71c7edee64d0bc9610db19866fe53d"
    },
    "format": "redacted_manifest",
    "manifest_hash": "sha256:c810af6bab5b569b4a37c6ad572f9bb4cb71c7edee64d0bc9610db19866fe53d",
    "path_or_uri": "docs/results/model_matrix/jump_tail__poe_kimi_k2_5_summary.json",
    "raw_prompts_included": false,
    "raw_responses_included": false
  }
}
