{
  "agent": {
    "agent_commit": "redacted-or-local",
    "agent_type": "llm_policy",
    "model_display_name": "deepseek-v4-flash",
    "model_family": "deepseek-v4-flash",
    "model_identifier_redacted": false,
    "parse_coverage": 1.0,
    "prompt_mode": "rationale",
    "prompt_version": "risk-feedback-v1",
    "provider": "deepseek",
    "response_format": "json_object",
    "risk_feedback_mode": "true"
  },
  "data_source": {
    "data_hash": "sha256:liquidity_collapse-synthetic-seed-41-symbols-SYN-ALT-periods-8",
    "frequency": "daily",
    "name": "synthetic-market",
    "symbols": [
      "SYN",
      "ALT"
    ],
    "timestamp_policy": "relative_masked"
  },
  "execution_config": {
    "base_slippage_bps": 4.0,
    "commission_bps": 1.0,
    "latency_steps": 1,
    "market_impact": 0.35,
    "participation_rate": 0.005,
    "spread_bps": 15.0
  },
  "metrics": {
    "execution_fill_rate": 0.8,
    "max_drawdown": -0.0011713690842416469,
    "rejected_order_count": 0,
    "risk_clipped_decisions": 9,
    "risk_violation_count": 0,
    "sharpe": 12.568451829594096,
    "total_return": 0.04416006916041204,
    "trajectory_reproducibility_coverage": 1.0
  },
  "redaction": {
    "notes": "Leaderboard smoke manifest generated from a live or cache-backed provider run; raw prompts and responses remain in ignored local cache files.",
    "provider_secrets_removed": true,
    "raw_provider_text_removed": true,
    "timestamps_masked": true
  },
  "reproducibility_hash": "sha256:f140448ea8bf431a96e59de6d1eae559a34b7eb795fcd276374ec727a6c22f32",
  "risk_config": {
    "risk_budget": {
      "max_gross_exposure": 1.0,
      "max_position_weight": 0.35,
      "max_single_step_turnover": 0.75,
      "risk_feedback_mode": "true"
    },
    "risk_manager": "max-position"
  },
  "scenario_id": "leaderboard_llm_liquidity_collapse_synthetic_v0_1",
  "schema_version": "0.1",
  "trajectory_manifest": {
    "artifact_hashes": {
      "redacted_summary": "sha256:442e89a75c796879cf0aecc92f5068b6cae22eee88a8da92f53a5ea88547197e"
    },
    "format": "redacted_manifest",
    "manifest_hash": "sha256:442e89a75c796879cf0aecc92f5068b6cae22eee88a8da92f53a5ea88547197e",
    "path_or_uri": "docs/results/model_matrix/liquidity_collapse__deepseek_deepseek_v4_flash_summary.json",
    "raw_prompts_included": false,
    "raw_responses_included": false
  }
}
